{
  "schemaVersion": 1,
  "status": "active",
  "testOwner": {"login": "zed-pkg-test", "id": 309134292, "type": "Organization"},
  "productionOwner": {"login": "zed-pkg", "id": 308416455, "type": "Organization"},
  "discoveryScope": {"kind": "organization-current-tips"},
  "relationshipRegistry": "architecture/repository-relationships.json",
  "policy": {
    "suffixInferenceAuthoritative": false,
    "bindExactDefaultBranchSha": true,
    "failClosedOnInvisiblePrivateSources": true,
    "silentPublicFallbackAllowed": false
  }
}
